{
  "schema": "evidence-graph/v1",
  "document": {
    "id": "doc-build-0001",
    "type": "subject-document",
    "issuer": "https://builder.example/workflow@refs/heads/develop",
    "created_at": "2026-08-12T00:10:00Z"
  },
  "subject": {
    "id": "subject-build-0001",
    "type": "build",
    "primary_digest": "sha256:fedcba9876543210fedcba9876543210fedcba9876543210fedcba9876543210"
  },
  "relations": [
    {
      "type": "built-from",
      "target_subject_id": "subject-builder-artifact-0001",
      "target_digest": "sha256:00112233445566778899aabbccddeeff00112233445566778899aabbccddeeff"
    },
    {
      "type": "built-from",
      "target_subject_id": "subject-source-0001",
      "target_digest": "sha256:0123456789abcdef0123456789abcdef0123456789abcdef0123456789abcdef"
    }
  ],
  "evidence": [
    {
      "evidence_type": "test",
      "subject_id": "subject-build-0001",
      "immutable_reference": "evidence.example/build-0001/test-result.json",
      "digest": "sha256:8899aabbccddeeff00112233445566778899aabbccddeeff0011223344556677",
      "issuer": "https://builder.example/workflow@refs/heads/develop",
      "issued_at": "2026-08-12T00:11:00Z"
    }
  ],
  "policy": {
    "bundle": "policy-bundle-0001",
    "decision": "allow"
  },
  "lifecycle": {
    "status": "verified"
  },
  "integrity": {
    "canonical_payload_digest": "sha256:abcdef0123456789abcdef0123456789abcdef0123456789abcdef0123456789",
    "signature": {
      "issuer": "https://builder.example/workflow@refs/heads/develop",
      "reference": "evidence.example/build-0001/integrity.sigstore.json",
      "digest": "sha256:0123456789abcdef0123456789abcdef0123456789abcdef0123456789abcdef"
    }
  }
}
