{
  "schema": "evidence-graph/v1",
  "document": {
    "id": "doc-artifact-0001",
    "type": "subject-document",
    "issuer": "https://builder.example/workflow@refs/heads/develop",
    "created_at": "2026-08-12T00:15:00Z"
  },
  "subject": {
    "id": "subject-artifact-0001",
    "type": "artifact",
    "primary_digest": "sha256:8899aabbccddeeff00112233445566778899aabbccddeeff0011223344556677"
  },
  "relations": [
    {
      "type": "produces",
      "target_subject_id": "subject-build-0001",
      "target_digest": "sha256:fedcba9876543210fedcba9876543210fedcba9876543210fedcba9876543210"
    }
  ],
  "evidence": [
    {
      "evidence_type": "sbom",
      "subject_id": "subject-artifact-0001",
      "immutable_reference": "evidence.example/artifact-0001/sbom.spdx.json",
      "digest": "sha256:0123456789abcdef0123456789abcdef0123456789abcdef0123456789abcdef",
      "issuer": "https://builder.example/workflow@refs/heads/develop",
      "issued_at": "2026-08-12T00:16:00Z"
    },
    {
      "evidence_type": "signature",
      "subject_id": "subject-artifact-0001",
      "immutable_reference": "evidence.example/artifact-0001/signature.sigstore.json",
      "digest": "sha256:abcdef0123456789abcdef0123456789abcdef0123456789abcdef0123456789",
      "issuer": "https://builder.example/workflow@refs/heads/develop",
      "issued_at": "2026-08-12T00:16:30Z"
    },
    {
      "evidence_type": "provenance",
      "subject_id": "subject-artifact-0001",
      "immutable_reference": "evidence.example/artifact-0001/provenance.intoto.jsonl",
      "digest": "sha256:fedcba9876543210fedcba9876543210fedcba9876543210fedcba9876543210",
      "issuer": "https://builder.example/workflow@refs/heads/develop",
      "issued_at": "2026-08-12T00:17:00Z"
    },
    {
      "evidence_type": "attestation",
      "subject_id": "subject-artifact-0001",
      "immutable_reference": "evidence.example/artifact-0001/sbom.intoto.jsonl",
      "digest": "sha256:00112233445566778899aabbccddeeff00112233445566778899aabbccddeeff",
      "issuer": "https://builder.example/workflow@refs/heads/develop",
      "issued_at": "2026-08-12T00:17:30Z"
    }
  ],
  "policy": {
    "bundle": "policy-bundle-0001",
    "decision": "allow"
  },
  "lifecycle": {
    "status": "verified"
  },
  "integrity": {
    "canonical_payload_digest": "sha256:abcdef0123456789abcdef0123456789abcdef0123456789abcdef0123456789",
    "signature": {
      "issuer": "https://builder.example/workflow@refs/heads/develop",
      "reference": "evidence.example/artifact-0001/integrity.sigstore.json",
      "digest": "sha256:8899aabbccddeeff00112233445566778899aabbccddeeff0011223344556677"
    }
  }
}
