{
  "schema": "evidence-graph/v1",
  "document": {
    "id": "doc-promotion-0001",
    "type": "subject-document",
    "issuer": "https://builder.example/promotion-workflow@refs/heads/main",
    "created_at": "2026-08-12T01:00:00Z"
  },
  "subject": {
    "id": "subject-promotion-0001",
    "type": "promotion",
    "primary_digest": "sha256:0123456789abcdef0123456789abcdef0123456789abcdef0123456789abcdef"
  },
  "relations": [
    {
      "type": "promotes",
      "target_subject_id": "subject-artifact-0001",
      "target_digest": "sha256:8899aabbccddeeff00112233445566778899aabbccddeeff0011223344556677"
    }
  ],
  "evidence": [
    {
      "evidence_type": "approval",
      "subject_id": "subject-promotion-0001",
      "immutable_reference": "evidence.example/promotion-0001/approval.json",
      "digest": "sha256:abcdef0123456789abcdef0123456789abcdef0123456789abcdef0123456789",
      "issuer": "https://builder.example/promotion-workflow@refs/heads/main",
      "issued_at": "2026-08-12T01:01:00Z",
      "expires_at": "2027-08-12T01:01:00Z"
    },
    {
      "evidence_type": "policy",
      "subject_id": "subject-promotion-0001",
      "immutable_reference": "evidence.example/promotion-0001/policy-decision.json",
      "digest": "sha256:fedcba9876543210fedcba9876543210fedcba9876543210fedcba9876543210",
      "issuer": "https://builder.example/promotion-workflow@refs/heads/main",
      "issued_at": "2026-08-12T01:01:30Z"
    }
  ],
  "policy": {
    "bundle": "policy-bundle-0001",
    "decision": "allow",
    "approval": "approvals/promotion-0001"
  },
  "lifecycle": {
    "status": "verified",
    "target_lane": "approved"
  },
  "integrity": {
    "canonical_payload_digest": "sha256:00112233445566778899aabbccddeeff00112233445566778899aabbccddeeff",
    "signature": {
      "issuer": "https://builder.example/promotion-workflow@refs/heads/main",
      "reference": "evidence.example/promotion-0001/integrity.sigstore.json",
      "digest": "sha256:8899aabbccddeeff00112233445566778899aabbccddeeff0011223344556677"
    }
  }
}
