{
  "schema": "evidence-graph/v1",
  "document": {
    "id": "doc-full-0001",
    "type": "subject-document",
    "issuer": "https://builder.example/workflow@refs/heads/develop",
    "created_at": "2026-08-12T04:00:00Z"
  },
  "subject": {
    "id": "subject-full-0001",
    "type": "artifact",
    "primary_digest": "sha256:8899aabbccddeeff00112233445566778899aabbccddeeff0011223344556677"
  },
  "relations": [
    {
      "type": "produces",
      "target_subject_id": "subject-build-0001",
      "target_digest": "sha256:fedcba9876543210fedcba9876543210fedcba9876543210fedcba9876543210"
    },
    {
      "type": "attests",
      "target_subject_id": "subject-artifact-0001"
    }
  ],
  "evidence": [
    {
      "evidence_type": "sbom",
      "subject_id": "subject-full-0001",
      "immutable_reference": "evidence.example/full-0001/sbom.spdx.json",
      "digest": "sha256:0123456789abcdef0123456789abcdef0123456789abcdef0123456789abcdef",
      "issuer": "https://builder.example/workflow@refs/heads/develop",
      "issued_at": "2026-08-12T04:01:00Z"
    },
    {
      "evidence_type": "approval",
      "subject_id": "subject-full-0001",
      "immutable_reference": "evidence.example/full-0001/approval.json",
      "digest": "sha256:abcdef0123456789abcdef0123456789abcdef0123456789abcdef0123456789",
      "issuer": "https://builder.example/workflow@refs/heads/develop",
      "issued_at": "2026-08-12T04:02:00Z",
      "expires_at": "2027-08-12T04:02:00Z"
    },
    {
      "evidence_type": "exception",
      "subject_id": "subject-full-0001",
      "immutable_reference": "evidence.example/full-0001/exception.json",
      "digest": "sha256:fedcba9876543210fedcba9876543210fedcba9876543210fedcba9876543210",
      "issuer": "https://builder.example/workflow@refs/heads/develop",
      "issued_at": "2026-08-12T04:03:00Z",
      "expires_at": "2026-11-12T04:03:00Z"
    }
  ],
  "policy": {
    "bundle": "policy-bundle-0001",
    "decision": "allow",
    "exception": "exceptions/0001",
    "approval": "approvals/0001"
  },
  "lifecycle": {
    "status": "verified",
    "target_lane": "approved",
    "phase_references": ["run-0001", "attempt-1"]
  },
  "integrity": {
    "canonical_payload_digest": "sha256:00112233445566778899aabbccddeeff00112233445566778899aabbccddeeff",
    "attestation": {
      "issuer": "https://builder.example/workflow@refs/heads/develop",
      "reference": "evidence.example/full-0001/integrity.intoto.jsonl",
      "digest": "sha256:8899aabbccddeeff00112233445566778899aabbccddeeff0011223344556677"
    }
  }
}
