{
  "schema": "evidence-graph/v1",
  "document": {
    "id": "doc-dependency-resolution-0001",
    "type": "subject-document",
    "issuer": "https://builder.example/workflow@refs/heads/develop",
    "created_at": "2026-08-12T00:05:00Z"
  },
  "subject": {
    "id": "subject-dependency-resolution-0001",
    "type": "dependency-resolution",
    "primary_digest": "sha256:00112233445566778899aabbccddeeff00112233445566778899aabbccddeeff"
  },
  "relations": [],
  "evidence": [
    {
      "evidence_type": "test",
      "subject_id": "subject-dependency-resolution-0001",
      "immutable_reference": "evidence.example/dependency-resolution-0001/test-result.json",
      "digest": "sha256:8899aabbccddeeff00112233445566778899aabbccddeeff0011223344556677",
      "issuer": "https://builder.example/workflow@refs/heads/develop",
      "issued_at": "2026-08-12T00:06:00Z"
    },
    {
      "evidence_type": "quality",
      "subject_id": "subject-dependency-resolution-0001",
      "immutable_reference": "evidence.example/dependency-resolution-0001/quality-gate.json",
      "digest": "sha256:0123456789abcdef0123456789abcdef0123456789abcdef0123456789abcdef",
      "issuer": "https://builder.example/workflow@refs/heads/develop",
      "issued_at": "2026-08-12T00:06:30Z"
    }
  ],
  "policy": {
    "bundle": "policy-bundle-0001",
    "decision": "allow"
  },
  "lifecycle": {
    "status": "verified"
  },
  "integrity": {
    "canonical_payload_digest": "sha256:abcdef0123456789abcdef0123456789abcdef0123456789abcdef0123456789",
    "attestation": {
      "issuer": "https://builder.example/workflow@refs/heads/develop",
      "reference": "evidence.example/dependency-resolution-0001/integrity.intoto.jsonl",
      "digest": "sha256:fedcba9876543210fedcba9876543210fedcba9876543210fedcba9876543210"
    }
  }
}
